{
  "schema_version": "phase1-pre-execution-gate-v1",
  "record_kind": "ROUTER_LAB_PHASE1_PRE_EXECUTION_GATE",
  "status": "PRE_EXECUTION_GATE_READY_FOR_REVIEW",
  "execution_authorized": false,
  "repository": "pzy19-prog/pzy-router-lab",
  "branch": "phase1/pre-execution-gate",
  "base_commit": "6e10cb1b2d5332180e748f8ddfa141bdecc69abc",
  "issue_5": "https://github.com/pzy19-prog/pzy-router-lab/issues/5",
  "issue_3": "https://github.com/pzy19-prog/pzy-router-lab/issues/3",
  "as_of": "2026-09-24",
  "fresh_read": {
    "main_commit": "6e10cb1b2d5332180e748f8ddfa141bdecc69abc",
    "current_branch_commit": "6e10cb1b2d5332180e748f8ddfa141bdecc69abc",
    "worktree_initially_clean": true,
    "issue_5_status": "OPEN; latest body read 2026-09-24",
    "issue_3_status": "OPEN; latest body read 2026-09-24",
    "phase0_design": "docs/phase0-selection.md and docs/benchmark-plan.md reread; synthetic cases remain dev-only",
    "playbook_preflight": "docs/playbook-preflight.md reread; no adopted current experiment rules beyond the accepted authority-boundary control"
  },
  "claim_hierarchy": {
    "formal_inferential_benchmark": "NOT_YET_JUSTIFIED",
    "pilot_type": "NON-INFERENTIAL PILOT",
    "pilot_scope": "After independent authorization only: adapter/load/runtime feasibility on public Phase 0 dev fixtures. It may report operational feasibility observations only; it must not report performance advantage, superiority, non-inferiority, acceptance/pass thresholds, or confirmatory claims.",
    "tracks": {
      "A_controlled_routing_comparison": {
        "primary_claim": "For cases with verified routing gold and identical eligible router-visible metadata, report each frozen system's decision-correctness counts and paired case-level differences versus Rules. This is descriptive only until a separately justified inferential design is approved.",
        "primary_metric": "decision correctness = exact correct decisions / assigned cases with verified non-UNKNOWN routing gold",
        "secondary_metrics": ["abstain/escalation correctness", "over-escalation", "router latency", "fallback/failure-class counts", "policy invariant violations", "UNKNOWN rate", "measured RAM/VRAM/CPU"],
        "paired_case_semantics": "Same case ID, same canonical serialized metadata and availability state for every included router. Exclude a router from Track A if identical input cannot be shown. Pair differences are case-wise; no independent-sample comparison.",
        "inferential_method_boundary": "Binary paired primary outcome: exact McNemar may be considered only after Sol approves the claim, alpha, sample size assumptions and missingness rule. Multiclass decision labels: report confusion matrices and per-class counts descriptively; no unapproved chi-square or class-wise tests. Continuous latency/resource measures: report raw paired observations and descriptive paired differences/medians; no unapproved t-test, rank test, interval, or tail claim."
      },
      "B_end_to_end_system_comparison": {
        "primary_claim": "For executable assigned cases scored blind under a frozen rubric, report system-level task-outcome counts and paired differences versus the frozen Rules-plus-executor configuration. Descriptive only until a separately justified inferential design is approved.",
        "primary_metric": "task outcome success = rubric-passing outputs / executable cases assigned to the system, with system-attributable output failures counted as failures",
        "secondary_metrics": ["abstain/escalation and fallback counts", "router and end-to-end latency", "resource use", "applicable token/currency cost", "UNKNOWN rate", "policy invariant violations"],
        "paired_case_semantics": "Systems receive the same case ID and rubric; each may receive only its pinned adapter-supported inputs. Pair case outcomes, but interpret as whole-system differences. Do not attribute differences to router alone when input, adapter, executor, or model pair differs.",
        "inferential_method_boundary": "Binary paired outcome: exact McNemar may be considered only after preregistration and Sol review. Multiclass outcome/failure classes: descriptive counts and confusion tables only. Continuous latency/resource/cost: raw paired case values and descriptive summaries only. No inferential test or acceptance threshold is currently authorized."
      }
    },
    "sample_size": "NOT_YET_JUSTIFIED: no target effect/precision objective, expected discordance or variance, outcome prevalence, alpha, power, multiplicity family, strata/clustering assumptions, or expected unscorable rate is supported by independent evidence. Phase 0's 12 exposed synthetic dev cases cannot justify formal n.",
    "alpha_power_and_thresholds": "NOT_YET_JUSTIFIED; no alpha, power, effect size, non-inferiority margin, acceptance threshold, or confirmatory confidence interval is invented or approved.",
    "unknown_denominator_rule": "Assigned cases remain in flow accounting. For an outcome-specific metric, exclude only cases whose gold/measurement is genuinely UNKNOWN from that metric's scorable denominator; publish assigned, eligible, scored, UNKNOWN, and failure counts and rates. System-attributable missing/corrupt output is failure. Non-system missing evidence is UNKNOWN, retained in flow counts. Never recode UNKNOWN as success or safe.",
    "multiplicity": "No secondary metric is confirmatory. Secondary metrics and strata are descriptive only; no multiplicity correction is claimed or needed for descriptive reporting. Before any inferential secondary claim, Sol must freeze the test family and correction procedure; otherwise label exploratory/descriptive.",
    "descriptive_only": ["all pilot observations", "all secondary metrics", "all strata/subgroups", "multiclass class-level comparisons", "continuous latency/resource/cost summaries", "any comparison using provisional or UNKNOWN gold", "all Track B differences where system components differ"]
  },
  "heldout_governance": {
    "formal_heldout_created": false,
    "formal_heldout_content_present": false,
    "status": "PROTOCOL_ONLY; population quotas, exact sample count, named data owner and unseal authorization await independent review",
    "custodian_role": "HELDOUT_CUSTODIAN: a named person appointed by the data owner, independent of router/adapter/executor implementation, tuning, and candidate selection. If one person cannot satisfy the separation, a separate data owner must appoint and audit the role.",
    "access": {
      "may_see_content": ["HELDOUT_CUSTODIAN", "authorized case authors while authoring", "independent route-gold adjudicators for route cases assigned to them", "independent outcome adjudicators for anonymized output and the minimum task context required to score", "frozen runner process only after written unseal authorization; no interactive implementer access"],
      "must_not_see_content_before_unseal": ["router/adapter implementers", "candidate and configuration selectors", "benchmark operators outside the frozen runner", "public repository readers"],
      "implementer_after_unseal": "No direct prompt, label, per-case digest, or result access until all systems and configs are irreversibly locked; any exposure/change retires that heldout version for confirmatory use.",
      "reviewer_visibility": "Independent reviewer may inspect protocol, role assignments, access logs, commitment and non-revealing manifest fields. Prompt bytes and per-case prompt digests stay sealed until authorized unseal."
    },
    "population": "Newly authored or lawfully sampled, de-identified English and Chinese task requests representative of the Router Lab's explicitly declared local-first routing use cases; exclude confidential/private source text unless separately authorized and protected. Population definition requires data-owner and Sol review before generation.",
    "strata": ["language: zh, en, mixed only when both languages are supported", "task family: structured transformation, information extraction/classification, short-form reasoning/response; exact families to be confirmed from target population", "policy/risk: ordinary, elevated, high-risk/manual-review", "execution mode: policy-only versus executor-required"],
    "sample_frame": "Purpose-authored cases or an approved, rights-cleared source frame frozen before generation; no Phase 0 case, paraphrase, benchmark item, or model-output-derived item. Exact source, quotas, sample count, inclusion/exclusion criteria, and rights remain NOT_YET_JUSTIFIED and require approval before generation.",
    "generation_protocol": ["Freeze population, strata, quotas, inclusion/exclusion criteria, language policy, scoring rubrics, executor/model identities and authoring recipe before case creation.", "Custodian generates or samples cases only after adapter/configuration lock; candidate outputs may not be used to author, filter, rewrite or select cases.", "Record provenance, rights, authoring method/version, timestamps, inclusion decisions and contamination review for every case.", "Assign one random opaque UUID per case; never derive IDs from content or reuse IDs across splits.", "Store prompt bytes as exact UTF-8 with a declared LF policy. Compute prompt SHA-256 over exact bytes and router-input SHA-256 over canonical UTF-8 JSON (sorted keys, compact separators, ensure_ascii=false); keep digests private until unseal."],
    "sealing": "Store prompt, labels, per-case digests and access events in a private access-controlled store. Create a signed or append-only manifest with dataset version, case UUIDs, generation/source details, rubric and protocol versions, file-level and per-case digests, timestamps and access log. Publish only a non-revealing commitment before evaluation. Never commit formal heldout content or its per-case prompt digests to this repository.",